{
  "$schema": "https://json-schema.org/draft/2020-12/schema",
  "$id": "urn:enterprise-agent:contracts:ChatCompletionRequest",
  "type": "object",
  "additionalProperties": false,
  "required": [
    "model",
    "messages",
    "stream"
  ],
  "properties": {
    "model": {
      "oneOf": [
        {
          "type": "string",
          "minLength": 1,
          "maxLength": 120,
          "pattern": "^[A-Za-z0-9][A-Za-z0-9._-]*$"
        },
        {
          "type": "string",
          "const": "enterprise/default"
        }
      ]
    },
    "messages": {
      "type": "array",
      "minItems": 1,
      "items": {
        "oneOf": [
          {
            "type": "object",
            "additionalProperties": false,
            "required": [
              "role",
              "content"
            ],
            "properties": {
              "role": {
                "type": "string",
                "enum": [
                  "system",
                  "user"
                ]
              },
              "content": {
                "type": "string"
              },
              "name": {
                "type": "string",
                "minLength": 1,
                "maxLength": 255
              }
            }
          },
          {
            "type": "object",
            "additionalProperties": false,
            "required": [
              "role"
            ],
            "properties": {
              "role": {
                "type": "string",
                "const": "assistant"
              },
              "content": {
                "oneOf": [
                  {
                    "type": "string"
                  },
                  {
                    "type": "null"
                  }
                ]
              },
              "name": {
                "type": "string",
                "minLength": 1,
                "maxLength": 255
              },
              "tool_calls": {
                "type": "array",
                "minItems": 1,
                "items": {
                  "type": "object",
                  "additionalProperties": false,
                  "required": [
                    "id",
                    "type",
                    "function"
                  ],
                  "properties": {
                    "id": {
                      "type": "string",
                      "minLength": 1,
                      "maxLength": 255
                    },
                    "type": {
                      "type": "string",
                      "const": "function"
                    },
                    "function": {
                      "type": "object",
                      "additionalProperties": false,
                      "required": [
                        "name",
                        "arguments"
                      ],
                      "properties": {
                        "name": {
                          "type": "string",
                          "minLength": 1,
                          "maxLength": 128
                        },
                        "arguments": {
                          "type": "string",
                          "minLength": 1,
                          "maxLength": 1048576
                        }
                      }
                    }
                  }
                }
              },
              "reasoning_content": {
                "type": "string"
              },
              "prefix": {
                "type": "boolean"
              }
            }
          },
          {
            "type": "object",
            "additionalProperties": false,
            "required": [
              "role",
              "content",
              "tool_call_id"
            ],
            "properties": {
              "role": {
                "type": "string",
                "const": "tool"
              },
              "content": {
                "type": "string"
              },
              "name": {
                "type": "string",
                "minLength": 1,
                "maxLength": 255
              },
              "tool_call_id": {
                "type": "string",
                "minLength": 1,
                "maxLength": 255
              }
            }
          }
        ]
      }
    },
    "tools": {
      "type": "array",
      "items": {
        "type": "object",
        "additionalProperties": false,
        "required": [
          "type",
          "function"
        ],
        "properties": {
          "type": {
            "type": "string",
            "const": "function"
          },
          "function": {
            "type": "object",
            "additionalProperties": false,
            "required": [
              "name"
            ],
            "properties": {
              "name": {
                "type": "string",
                "minLength": 1,
                "maxLength": 128
              },
              "description": {
                "type": "string",
                "minLength": 1,
                "maxLength": 4096
              },
              "parameters": {
                "type": "object",
                "additionalProperties": true
              }
            }
          }
        }
      }
    },
    "tool_choice": {
      "oneOf": [
        {
          "type": "string",
          "enum": [
            "none",
            "auto",
            "required"
          ]
        },
        {
          "type": "object",
          "additionalProperties": false,
          "required": [
            "type",
            "function"
          ],
          "properties": {
            "type": {
              "type": "string",
              "const": "function"
            },
            "function": {
              "type": "object",
              "additionalProperties": false,
              "required": [
                "name"
              ],
              "properties": {
                "name": {
                  "type": "string",
                  "minLength": 1,
                  "maxLength": 128
                }
              }
            }
          }
        }
      ]
    },
    "temperature": {
      "type": "number",
      "minimum": 0,
      "maximum": 2
    },
    "top_p": {
      "type": "number",
      "minimum": 0,
      "maximum": 1
    },
    "max_tokens": {
      "type": "integer",
      "minimum": 1,
      "maximum": 2147483647
    },
    "stop": {
      "oneOf": [
        {
          "type": "string",
          "minLength": 1,
          "maxLength": 4096
        },
        {
          "type": "array",
          "minItems": 1,
          "maxItems": 4,
          "items": {
            "type": "string",
            "minLength": 1,
            "maxLength": 4096
          }
        },
        {
          "type": "null"
        }
      ]
    },
    "stream": {
      "type": "boolean",
      "const": true
    },
    "stream_options": {
      "type": "object",
      "additionalProperties": false,
      "properties": {
        "include_usage": {
          "type": "boolean"
        }
      }
    }
  }
}
